{
  "schemaVersion": "1.0",
  "synthetic": true,
  "accountId": "fictional-local-account",
  "adapterVersion": "mock-1",
  "source": "mock-not-live",
  "term": {
    "id": "sample-autumn-2026",
    "schoolYear": "2026-2027",
    "termCode": "SAMPLE",
    "firstTeachingMonday": "2026-08-31",
    "timezone": "Asia/Shanghai",
    "weekCount": 18
  },
  "coverage": {
    "kind": "TERM",
    "weeks": [
      1,
      2,
      3,
      4,
      5,
      6,
      7,
      8,
      9,
      10,
      11,
      12,
      13,
      14,
      15,
      16,
      17,
      18
    ]
  },
  "fetchedAt": "2026-10-22T16:00:00+08:00",
  "periods": [
    {
      "index": 1,
      "start": "08:00",
      "end": "08:45"
    },
    {
      "index": 2,
      "start": "09:00",
      "end": "09:45"
    },
    {
      "index": 3,
      "start": "10:00",
      "end": "10:45"
    },
    {
      "index": 4,
      "start": "11:00",
      "end": "11:45"
    },
    {
      "index": 5,
      "start": "12:00",
      "end": "12:45"
    },
    {
      "index": 6,
      "start": "13:00",
      "end": "13:45"
    },
    {
      "index": 7,
      "start": "14:00",
      "end": "14:45"
    },
    {
      "index": 8,
      "start": "15:00",
      "end": "15:45"
    },
    {
      "index": 9,
      "start": "16:00",
      "end": "16:45"
    },
    {
      "index": 10,
      "start": "17:00",
      "end": "17:45"
    },
    {
      "index": 11,
      "start": "18:00",
      "end": "18:45"
    },
    {
      "index": 12,
      "start": "19:00",
      "end": "19:45"
    },
    {
      "index": 13,
      "start": "20:00",
      "end": "20:45"
    },
    {
      "index": 14,
      "start": "21:00",
      "end": "21:45"
    }
  ],
  "meetings": [
    {
      "id": "fictional-meeting-0",
      "courseId": "fictional-class-0",
      "name": "程序设计（虚构）",
      "teacherNames": [
        "虚构教师"
      ],
      "location": "示例楼 101",
      "weekday": 1,
      "periodStart": 1,
      "periodEnd": 2,
      "weeks": [
        1,
        3,
        5,
        8
      ]
    },
    {
      "id": "fictional-meeting-1",
      "courseId": "fictional-class-1",
      "name": "数据结构（虚构）",
      "teacherNames": [
        "虚构教师"
      ],
      "location": "示例楼 101",
      "weekday": 2,
      "periodStart": 3,
      "periodEnd": 4,
      "weeks": [
        1,
        2,
        3,
        4,
        5,
        6,
        7,
        8,
        9,
        10,
        11,
        12,
        13,
        14,
        15,
        16,
        17,
        18
      ]
    },
    {
      "id": "fictional-meeting-2",
      "courseId": "fictional-class-2",
      "name": "大学物理（虚构 A 班）",
      "teacherNames": [
        "虚构教师"
      ],
      "location": "示例楼 101",
      "weekday": 3,
      "periodStart": 5,
      "periodEnd": 6,
      "weeks": [
        1,
        2,
        3,
        4,
        5,
        6,
        7,
        8,
        9,
        10,
        11,
        12,
        13,
        14,
        15,
        16,
        17,
        18
      ]
    },
    {
      "id": "fictional-meeting-3",
      "courseId": "fictional-class-3",
      "name": "大学物理（虚构 A 班）",
      "teacherNames": [
        "虚构教师"
      ],
      "location": "示例楼 101",
      "weekday": 3,
      "periodStart": 5,
      "periodEnd": 7,
      "weeks": [
        1,
        2,
        3,
        4,
        5,
        6,
        7,
        8,
        9,
        10,
        11,
        12,
        13,
        14,
        15,
        16,
        17,
        18
      ]
    },
    {
      "id": "fictional-meeting-4",
      "courseId": "fictional-class-4",
      "name": "离散数学（虚构）",
      "teacherNames": [
        "虚构教师"
      ],
      "location": "示例楼 101",
      "weekday": 4,
      "periodStart": 9,
      "periodEnd": 12,
      "weeks": [
        1,
        2,
        3,
        4,
        5,
        6,
        7,
        8,
        9,
        10,
        11,
        12,
        13,
        14,
        15,
        16,
        17,
        18
      ]
    },
    {
      "id": "fictional-meeting-5",
      "courseId": "fictional-class-5",
      "name": "实验课（虚构）",
      "teacherNames": [
        "虚构教师"
      ],
      "location": "示例楼 101",
      "weekday": 5,
      "periodStart": 13,
      "periodEnd": 14,
      "weeks": [
        1,
        2,
        3,
        4,
        5,
        6,
        7,
        8,
        9,
        10,
        11,
        12,
        13,
        14,
        15,
        16,
        17,
        18
      ]
    }
  ],
  "notes": "全部为虚构示例。教学周锚点和节次时间未经学校确认，不可作为真实课表使用。Schema 仅检查结构；跨字段、身份和空结果语义需业务校验。"
}